{
  "outreach_id": "O-0009",
  "lead_id": "LH-0009",
  "channel": "whatsapp",
  "draft": "Hi, this is Fahad from Hope Theory.\n\nWhile researching JG Mart (expanded opportunity), a few things stood out to me:\n• Hyperlocal grocery delivery operates via WhatsApp — no order tracking or automated delivery scheduling\n• Customer support and order state changes are manual — slow at scale\n\nI build AI agents that fix exactly this. For a business like yours, I'd start with an AI order agent that takes orders over WhatsApp, confirms stock, and schedules deliveries.\n\nI've already built a working demo — happy to show you in 15 minutes. No commitment, just want to show you what it does.\n\n\nYou can also try the quick ROI calculator - open artifacts/calculators-live/LH-0009-calculator-live.html and drag the sliders.\nBest,\nFahad",
  "status": "pending_approval",
  "human_approved_at": "",
  "sent_at": "",
  "response_at": "",
  "response": ""
}
